Date,Transaction Type,Serial Number,Description,Amount,Daily Posted Balance
5/2/2022,Deposit,,WIRE REF# 20220502-00019490 INCOMING WIRE TRANSFER,"$45,000 ",
5/2/2022,Debit,,GLOBAL STL GLOBAL PAYMENTS MODEVNETWORK  LLC ACH CORP DEBIT,($4.95),
5/2/2022,Debit,,Payables Bill.com ModevNetwork LLC ACH CORP DEBIT,"($6,000)",
5/2/2022,Debit,,ACH PMT AMEX EPAYMENT Peter Erickson ACH CORP DEBIT,"($30,000)","$42,400.33 "
5/3/2022,Debit,,BILLING AUTHNET GATEWAY MODEVNETWORK LLC ACH CORP DEBIT,($25),
5/3/2022,Debit,,MOBILE PMT CAPITAL ONE PETER G ERICKSON ACH CORP DEBIT,"($2,500)",
5/3/2022,Debit,,FEE 857985 GUSTO ModevNetwork LLC ACH CORP DEBIT,($51),
5/3/2022,Debit,,EDI PYMNTS Upwork Escrow In Peter Erickson ACH CORP DEBIT,"($1,995.50)","$37,828.83 "
5/4/2022,Debit,,COMM LOANS TRUIST 0006997848/0000000018 ACH CORP DEBIT,"($1,624.71)","$36,204.12 "
